{
  "artifact_type": "performance.v1",
  "schema_version": "v1",
  "performance_id": "givecare.performance.social-fall-checkin.24h.2026-04-13",
  "run_id": "givecare.run.social-fall-checkin.publish.2026-04-12t172000z",
  "brief_id": "givecare.brief.fall-checkin.social-email.2026-04-12",
  "brand_id": "givecare.brand.core",
  "writer": {
    "repo": "agentcy-measure",
    "module": "agentcy-measure"
  },
  "workflow": "social.post",
  "measured_at": "2026-04-13T17:23:11Z",
  "observations": [
    {
      "platform": "linkedin",
      "post_id": "linkedin.ugc.987654321",
      "metrics": {
        "impressions": 1840,
        "clicks": 47
      }
    }
  ],
  "lineage": {
    "source_voice_pack_id": "givecare.voice.fall-checkin.v1",
    "campaign_id": "givecare.campaign.fall-checkin.2026q2",
    "signal_id": "givecare.signal.support-calls.fall-2026-04"
  }
}
